{
  "name": "gen-order-vocabulary-requirement-and-children",
  "description": "Generated (order): vocabulary-requirement beside children on node a; the gate's order decides which error wins",
  "document": {
    "version": "1.0.0",
    "root": {
      "type": "Column",
      "id": "root",
      "children": [
        {
          "type": "Button",
          "id": "a",
          "properties": {
            "label": "A",
            "enabled": true
          },
          "children": [
            {
              "type": "Text",
              "id": "a-child",
              "properties": {
                "text": "x"
              }
            }
          ]
        },
        {
          "type": "Button",
          "id": "b",
          "properties": {
            "label": "B",
            "enabled": true
          }
        }
      ]
    },
    "vocabulary": {
      "name": "other"
    }
  },
  "expect": {
    "error": {
      "type": "SchemaViolation",
      "rule": "vocabulary-requirement",
      "expected": "other"
    }
  }
}
