{
  "name": "gen-numeric-031",
  "description": "Generated (seed 20260816): str((4611686018427387904 / 9007199254740993) / 0.0001)",
  "document": {
    "version": "1.0.0",
    "root": {
      "type": "Text",
      "id": "r",
      "properties": {
        "text": {
          "$expr": "str((4611686018427387904 / 9007199254740993) / 0.0001)"
        }
      }
    }
  },
  "expect": {
    "view": {
      "type": "Text",
      "reference": "r",
      "properties": {
        "text": "5110000.0"
      }
    },
    "occurrences": []
  }
}
