{
  "name": "gen-numeric-140",
  "description": "Generated (seed 20260816): $str($double((0 - 9223372036854775807 - 1)))",
  "document": {
    "version": "1.0.0",
    "root": {
      "type": "Text",
      "id": "r",
      "properties": {
        "text": {
          "$expr": "$str($double((0 - 9223372036854775807 - 1)))"
        }
      }
    }
  },
  "expect": {
    "view": {
      "type": "Text",
      "reference": "r",
      "properties": {
        "text": "-9.223372036854776e18"
      }
    },
    "occurrences": []
  }
}
