{
  "name": "gen-string-143",
  "description": "Generated (seed 20260831): $replace($join($split('ababab', 'aa'), '-'), ',', 'ab')",
  "document": {
    "version": "2.1.0",
    "root": {
      "type": "Text",
      "id": "r",
      "properties": {
        "text": {
          "$expr": "$replace($join($split('ababab', 'aa'), '-'), ',', 'ab')"
        }
      }
    }
  },
  "expect": {
    "view": {
      "type": "Text",
      "reference": "r",
      "properties": {
        "text": "ababab"
      }
    },
    "occurrences": []
  }
}
