{
  "name": "gen-order-id-duplicate-alone",
  "description": "Generated (order): id-duplicate alone, on node a",
  "document": {
    "version": "1.0.0",
    "root": {
      "type": "Column",
      "id": "root",
      "children": [
        {
          "type": "Button",
          "id": "root",
          "properties": {
            "label": "A",
            "enabled": true
          }
        },
        {
          "type": "Button",
          "id": "b",
          "properties": {
            "label": "B",
            "enabled": true
          }
        }
      ]
    }
  },
  "expect": {
    "error": {
      "type": "SchemaViolation",
      "rule": "id-uniqueness",
      "node": "root"
    }
  }
}
