{
  "name": "gen-string-095",
  "description": "Generated (seed 20260831): $substring('ada@example.com', $indexOf('\\\\', 'a'), $length(',lead'))",
  "document": {
    "version": "2.1.0",
    "root": {
      "type": "Text",
      "id": "r",
      "properties": {
        "text": {
          "$expr": "$substring('ada@example.com', $indexOf('\\\\', 'a'), $length(',lead'))"
        }
      }
    }
  },
  "expect": {
    "view": {
      "type": "Text",
      "reference": "r",
      "properties": {
        "text": "ada@e"
      }
    },
    "occurrences": []
  }
}
