{
  "name": "gen-order-context-missing-and-expression",
  "description": "Generated (order): context-missing beside expression on node a; the gate's order decides which error wins",
  "document": {
    "version": "1.0.0",
    "root": {
      "type": "Column",
      "id": "root",
      "children": [
        {
          "type": "Button",
          "id": "a",
          "properties": {
            "label": {
              "$expr": "state.nope"
            },
            "enabled": true
          }
        },
        {
          "type": "Button",
          "id": "b",
          "properties": {
            "label": "B",
            "enabled": true
          }
        }
      ]
    },
    "context": {
      "who": "string"
    }
  },
  "expect": {
    "error": {
      "type": "SchemaViolation",
      "rule": "expression",
      "node": "a",
      "expected": "string"
    }
  }
}
