{
  "name": "gen-order-vocabulary-requirement-and-action-encoding",
  "description": "Generated (order): vocabulary-requirement beside action-encoding on node a; the gate's order decides which error wins",
  "document": {
    "version": "1.0.0",
    "root": {
      "type": "Column",
      "id": "root",
      "children": [
        {
          "type": "Button",
          "id": "a",
          "properties": {
            "label": "A",
            "enabled": true
          },
          "on": {
            "tap": [
              {
                "action": "$set",
                "key": "undeclared",
                "value": 1
              }
            ]
          }
        },
        {
          "type": "Button",
          "id": "b",
          "properties": {
            "label": "B",
            "enabled": true
          }
        }
      ]
    },
    "vocabulary": {
      "name": "other"
    }
  },
  "expect": {
    "error": {
      "type": "SchemaViolation",
      "rule": "vocabulary-requirement",
      "expected": "other",
      "found": "generated_order"
    }
  }
}
