{
  "name": "gen-string-032",
  "description": "Generated (seed 20260831): $replace('abc', ',', '\ud83d\ude00')",
  "document": {
    "version": "2.1.0",
    "root": {
      "type": "Text",
      "id": "r",
      "properties": {
        "text": {
          "$expr": "$replace('abc', ',', '\ud83d\ude00')"
        }
      }
    }
  },
  "expect": {
    "view": {
      "type": "Text",
      "reference": "r",
      "properties": {
        "text": "abc"
      }
    },
    "occurrences": []
  }
}
