{
  "name": "gen-order-construct-then-undeclared-property",
  "description": "Generated (order): construct on node a, then undeclared-property on node b; the first defect in document order wins",
  "document": {
    "version": "1.0.0",
    "root": {
      "type": "Column",
      "id": "root",
      "children": [
        {
          "type": "$Button",
          "id": "a",
          "properties": {
            "label": "A",
            "enabled": true
          }
        },
        {
          "type": "Meta",
          "id": "b",
          "properties": {
            "key": "k",
            "extra": 1
          }
        }
      ]
    }
  },
  "expect": {
    "error": {
      "type": "SchemaViolation",
      "rule": "construct",
      "node": "a",
      "expected": "component type",
      "found": "$Button"
    }
  }
}
