{
  "name": "gen-numeric-001",
  "description": "Generated (seed 20260816): str(int(9007199254740992.0))",
  "document": {
    "version": "1.0.0",
    "root": {
      "type": "Text",
      "id": "r",
      "properties": {
        "text": {
          "$expr": "str(int(9007199254740992.0))"
        }
      }
    }
  },
  "expect": {
    "view": {
      "type": "Text",
      "reference": "r",
      "properties": {
        "text": "9007199254740992"
      }
    },
    "occurrences": []
  }
}
