{
  "name": "conditional-branch-path-names-the-branch",
  "description": "A node in a branch is pathed by branch and index, so a report says which",
  "document": {
    "version": "2.1.0",
    "root": {
      "type": "Column",
      "id": "c",
      "children": [
        {
          "type": "$if",
          "condition": {
            "$expr": "false"
          },
          "then": [
            {
              "type": "Text",
              "properties": {
                "text": "a"
              }
            }
          ],
          "else": [
            {
              "type": "Text",
              "properties": {
                "text": "b"
              }
            }
          ]
        }
      ]
    }
  },
  "expect": {
    "view": {
      "type": "Column",
      "reference": "c",
      "children": [
        {
          "type": "Text",
          "reference": "root/children[0]/else[0]",
          "properties": {
            "text": "b"
          }
        }
      ]
    },
    "occurrences": []
  }
}
