{
  "name": "gen-numeric-fn-048",
  "description": "Generated (seed 20260830): $str($abs($ceil(-(0.0))))",
  "document": {
    "version": "2.1.0",
    "root": {
      "type": "Text",
      "id": "r",
      "properties": {
        "text": {
          "$expr": "$str($abs($ceil(-(0.0))))"
        }
      }
    }
  },
  "expect": {
    "view": {
      "type": "Text",
      "reference": "r",
      "properties": {
        "text": "0.0"
      }
    },
    "occurrences": []
  }
}
