{
  "name": "gen-string-016",
  "description": "Generated (seed 20260831): $join($split('', 'a'), 'a')",
  "document": {
    "version": "2.1.0",
    "root": {
      "type": "Text",
      "id": "r",
      "properties": {
        "text": {
          "$expr": "$join($split('', 'a'), 'a')"
        }
      }
    }
  },
  "expect": {
    "view": {
      "type": "Text",
      "reference": "r",
      "properties": {
        "text": ""
      }
    },
    "occurrences": []
  }
}
