{
  "name": "gen-order-construct-then-unknown-type",
  "description": "Generated (order): construct on node a, then unknown-type on node b; the first defect in document order wins",
  "document": {
    "version": "1.0.0",
    "root": {
      "type": "Column",
      "id": "root",
      "children": [
        {
          "type": "$Button",
          "id": "a",
          "properties": {
            "label": "A",
            "enabled": true
          }
        },
        {
          "type": "Mystery",
          "id": "b",
          "properties": {
            "label": "B",
            "enabled": true
          }
        }
      ]
    }
  },
  "expect": {
    "error": {
      "type": "SchemaViolation",
      "rule": "construct",
      "node": "a",
      "expected": "component type"
    }
  }
}
